Question	Answer	Source
¿Puedo pagar mis facturas en las oficinas de Aigües de Barcelona?	No, no es posible realizar pagos en nuestras oficinas.	Editorial
¿Tengo que ser cliente de La Caixa para poder pagar mis facturas a través de ServiCaixa?	No, no es necesario que seas cliente de esta entidad, ni tampoco que seas usuario o usuaria de Línea Abierta de La Caixa.\n\nRecuerda que también podrás realizar el pago a través de nuestras entidades colaboradoras, mediante la Oficina en Red o a través de [La Caixa - Pagos Online](https://portal.lacaixa.es/pagos/impuestosrecibosmatriculas_es.html) con cualquier tarjeta de crédito (Visa/Mastercard) o de débito	Editorial
¿Mi tarjeta bancaria tiene que ser de La Caixa para poder realizar pagos en línea?	No, no es necesario que La Caixa sea la entidad emisora de la tarjeta. Sólo hace falta que tengas una tarjeta de crédito activa (Visa / Mastercard) o de débito.	Editorial
¿Puedo realizar el pago en línea en cualquier momento?	Sí, el servicio está disponible las 24 horas del día y los 365 días del año.	Editorial
¿Qué necesito para hacer pagos en línea?	Es necesario que tengas un ordenador o un dispositivo con conexión a Internet y una tarjeta bancaria activa en el momento de realizar la operación.	Editorial
¿El pago en línea tiene algún coste para mí?	No. Los pagos efectuados en línea no tienen ningún coste adicional.	Editorial
¿Qué ventajas tiene el pago en línea?	Disponibilidad total sin tener que desplazarte, confidencialidad y seguridad con tus datos bancarios.	Editorial
